{
  "_schema_version": "1.0.0",
  "adapter_name": "generic",
  "scenario_name": "echo_simple",
  "agent_run_result": {
    "response_text": "Hello, world!",
    "tool_calls": [
      {
        "name": "echo",
        "args": {"text": "Hello, world!"},
        "result": "Hello, world!",
        "error": null,
        "latency_ms": 10.0,
        "source": "hosted_mcp",
        "gen_ai_tool_call_id": "echo-001",
        "sequence_index": 0
      }
    ],
    "usage": {
      "input_tokens": 5,
      "output_tokens": 5,
      "cached_input_tokens": 0
    },
    "metadata": {
      "completeness": "complete",
      "mcp_coverage": "hosted_in_process"
    },
    "cost_usd": 0.0001,
    "latency_seconds": 0.05,
    "trace_id": "00000000-0000-4000-8000-000000000001"
  },
  "expected_tool_calls": [
    {
      "name": "echo",
      "args": {"text": "Hello, world!"},
      "result": "Hello, world!",
      "error": null,
      "latency_ms_min": 0,
      "source": "hosted_mcp",
      "gen_ai_tool_call_id": "echo-001",
      "sequence_index": 0
    }
  ],
  "expected_errors": [],
  "reproducibility_footer": {
    "library_version": "0.1.0",
    "redaction_policy_hash": "sha256:placeholder",
    "started_at": "2026-05-19T00:00:00Z",
    "ended_at": "2026-05-19T00:00:01Z"
  }
}
